{
  "id": "mit-least-privilege",
  "name": "Least Privilege",
  "description": "Limit model, agent, retrieval, and tool permissions to the minimum required for the current user and task.",
  "version": "1.0.0",
  "status": "active",
  "tags": ["least_privilege", "tool_control", "agency"],
  "control_category": "architecture",
  "mitigates": [
    "obj-tool-misuse-resilience",
    "obj-excessive-agency-resilience",
    "obj-data-exfiltration-resilience",
    "af-tool-abuse"
  ],
  "implementation_guidance": [
    "Use scoped service credentials rather than broad user or administrator credentials.",
    "Bind tool access to task-specific authorization checks outside the model.",
    "Separate read, write, external communication, and irreversible operations into distinct permissions."
  ],
  "verification_methods": [
    "Inspect tool registry permissions and credential scopes.",
    "Run tests that attempt unnecessary or higher-privilege tool actions.",
    "Confirm denied actions are logged with user, tool, and policy context."
  ],
  "owasp_mappings": ["owasp-llm06-2025-excessive-agency"],
  "mitre_mappings": [],
  "references": ["ref-owasp-llm01-prompt-injection-2025", "ref-agentdojo"],
  "created_at": "2026-07-08",
  "updated_at": "2026-07-08"
}
