{
  "id": "mit-example-enforce-instruction-priority",
  "name": "Enforce Instruction Priority",
  "description": "Controls that preserve trusted instruction hierarchy when the application processes untrusted user, retrieval, or tool content.",
  "version": "0.1.0",
  "status": "draft",
  "tags": ["mitigation", "instruction_hierarchy", "prompt_injection"],
  "control_category": "architecture",
  "mitigates": ["obj-example-instruction-hierarchy-resilience", "af-example-direct-prompt-injection"],
  "implementation_guidance": [
    "Separate trusted instructions from untrusted content in application prompts and internal data structures.",
    "Label retrieved or user-provided content as data, not instructions.",
    "Add response-time checks for instruction priority conflicts."
  ],
  "verification_methods": [
    "Run direct and indirect instruction conflict tests.",
    "Confirm logs capture the source of instructions and data.",
    "Review responses for evidence of untrusted content changing policy boundaries."
  ],
  "owasp_mappings": ["owasp-example-llm01-2025-prompt-injection"],
  "mitre_mappings": ["atlas-example-aml-t0051-prompt-injection"],
  "references": ["ref-example-owasp-llm-top-10-2025"],
  "created_at": "2026-07-08",
  "updated_at": "2026-07-08"
}
