{
  "id": "mit-human-approval",
  "name": "Human Approval",
  "description": "Require explicit human approval for sensitive, irreversible, high-value, or externally visible actions.",
  "version": "1.0.0",
  "status": "active",
  "tags": ["human_in_the_loop", "approval", "agency"],
  "control_category": "operations",
  "mitigates": [
    "obj-tool-misuse-resilience",
    "obj-excessive-agency-resilience",
    "af-tool-abuse"
  ],
  "implementation_guidance": [
    "Define approval thresholds for financial, administrative, destructive, privacy-sensitive, and external communication actions.",
    "Present users with action summaries, data scopes, and destination details before execution.",
    "Keep approval decisions in audit logs separate from model-generated rationale."
  ],
  "verification_methods": [
    "Test whether high-risk actions pause for explicit confirmation.",
    "Confirm approval prompts accurately describe action impact and data exposure.",
    "Review audit trails for approved, denied, and timed-out actions."
  ],
  "owasp_mappings": ["owasp-llm06-2025-excessive-agency"],
  "mitre_mappings": [],
  "references": ["ref-owasp-llm01-prompt-injection-2025", "ref-nist-ai-rmf-1-0"],
  "created_at": "2026-07-08",
  "updated_at": "2026-07-08"
}
