{
  "id": "mit-prompt-isolation",
  "name": "Prompt Isolation",
  "description": "Separate trusted instructions, user input, retrieved content, and tool outputs so untrusted data is not treated as authority.",
  "version": "1.0.0",
  "status": "active",
  "tags": ["prompt_isolation", "trust_boundary", "prompt_injection"],
  "control_category": "architecture",
  "mitigates": [
    "obj-prompt-injection-resilience",
    "obj-indirect-prompt-injection-resilience",
    "af-prompt-injection",
    "af-indirect-prompt-injection"
  ],
  "implementation_guidance": [
    "Represent external content as quoted data with source labels and explicit trust levels.",
    "Keep system and developer instructions outside user-editable or retrievable text channels.",
    "Design prompts and orchestration code so retrieved content cannot redefine task authority."
  ],
  "verification_methods": [
    "Test direct and indirect instruction conflicts across all input channels.",
    "Inspect prompt assembly code for trusted and untrusted content boundaries.",
    "Confirm response evidence preserves the source of each instruction-like statement."
  ],
  "owasp_mappings": ["owasp-llm01-2025-prompt-injection"],
  "mitre_mappings": [
    "atlas-aml-t0051-prompt-injection",
    "atlas-aml-t0051-000-llm-prompt-injection-direct",
    "atlas-aml-t0051-001-llm-prompt-injection-indirect"
  ],
  "references": ["ref-owasp-llm01-prompt-injection-2025", "ref-indirect-prompt-injection-paper"],
  "created_at": "2026-07-08",
  "updated_at": "2026-07-08"
}
