{
  "id": "mit-tool-permission-control",
  "name": "Tool Permission Control",
  "description": "Enforce runtime checks that bind tool selection, tool inputs, and tool outputs to user intent and policy.",
  "version": "1.0.0",
  "status": "active",
  "tags": ["tool_permissions", "agent_security", "runtime_control"],
  "control_category": "architecture",
  "mitigates": [
    "obj-tool-misuse-resilience",
    "obj-excessive-agency-resilience",
    "obj-data-exfiltration-resilience",
    "af-tool-abuse"
  ],
  "implementation_guidance": [
    "Gate every tool call through policy code rather than trusting model-selected actions.",
    "Validate tool arguments against user intent, data classification, and destination rules.",
    "Treat tool outputs as untrusted content when they re-enter the model context."
  ],
  "verification_methods": [
    "Run tool-boundary tests for read, write, external-send, and administrative operations.",
    "Confirm untrusted tool output cannot request later tool calls without policy checks.",
    "Review telemetry linking tool calls to user intent and approval state."
  ],
  "owasp_mappings": [
    "owasp-llm01-2025-prompt-injection",
    "owasp-llm06-2025-excessive-agency"
  ],
  "mitre_mappings": ["atlas-aml-t0051-001-llm-prompt-injection-indirect"],
  "references": ["ref-agentdojo", "ref-indirect-prompt-injection-paper"],
  "created_at": "2026-07-08",
  "updated_at": "2026-07-08"
}
